degree_class_code;degree_class_name_it;degree_class_number;programme_type_code;degree_class_name_en
PSC350PAS;LABORATORIO DI TECNICA MICROBIOLOGICA;C350-PAS;PS;
PSC360PAS;LABORATORIO DI TECNOLOGIA CARTARIA ED ESERCITAZIONI DI CARTIERA;C360-PAS;PS;
PSC370PAS;LABORATORIO E REPARTI DI LAVORAZIONE DEL LEGNO;C370-PAS;PS;
PSC380PAS;LABORATORIO E REPARTI DI LAVORAZIONE PER LE ARTI GRAFICHE;C380-PAS;PS;
PSC390PAS;LABORATORIO E REPARTI DI LAVORAZIONE PER L'INDUSTRIA MINERARIA;C390-PAS;PS;
PSC420PAS;LABORATORIO TECNOLOGICO PER IL MARMO-REPARTI SCULTURA,SMODELLATURA,DECORAZIONE E ORNATO;C420-PAS;PS;
PSC430PAS;LABORATORIO TECNOLOGICO PER L'EDILIZIA ED ESERCITAZIONI DI TOPOGRAFIA;C430-PAS;PS;
PSC440PAS;MASSOCHINESITERAPIA;C440-PAS;PS;
PSC450PAS;METODOLOGIE OPERATIVE NEI SERVIZI SOCIALI;C450-PAS;PS;
PSC460PAS;REPARTI DI LAVORAZIONE PER IL MONTAGGIO CINEMATOGRAFICO E TELEVISIVO;C460-PAS;PS;
PSC470PAS;REPARTI DI LAVORAZIONE PER LA REGISTRAZIONE DEL SUONO;C470-PAS;PS;
PSC480PAS;REPARTI DI LAVORAZIONE PER LA RIPRESA CINEMATOGRAFICA E TELEVISIVA;C480-PAS;PS;
PSC490PAS;REPARTI DI LAVORAZIONE PER LE ARTI FOTOGRAFICHE;C490-PAS;PS;
PSC500PAS;TECNICA DEI SERVIZI ED ESERCITAZIONI PRATICHE DI CUCINA;C500-PAS;PS;
PSC510PAS;TECNICA DEI SERVIZI ED ESERCITAZIONI PRATICHE DI SALA BAR;C510-PAS;PS;
PSC520PAS;TECNICA DEI SERVIZI E PRATICA OPERATIVA;C520-PAS;PS;
PSD601PAS;ARTE DELLA LAVORAZIONE DEI METALLI;D601-PAS;PS;
PSD602PAS;ARTE DELL'OREFICERIA, DELLA LAVORAZIONE DELLE PIETRE DURE E DELLE GEMME;D602-PAS;PS;
PSD603PAS;ARTE DEL DISEGNO D'ANIMAZIONE;D603-PAS;PS;
PSD604PAS;ARTE DELLA RIPRESA E MONTAGGIO PER IL DISEGNO ANIMATO;D604-PAS;PS;
PSD605PAS;ARTE DELLA TESSITURA E DELLA DECORAZIONE DEI TESSUTI;D605-PAS;PS;
PSD608PAS;ARTE DELLA DECORAZIONE E COTTURA DEI PRODOTTI CERAMICI;D608-PAS;PS;
PSD609PAS;ARTE DELLA FORMATURA E FOGGIATURA;D609-PAS;PS;
PSD610PAS;ARTE DELLA FOTOGRAFIA E DELLA CINEMATOGRAFIA;D610-PAS;PS;
PSD611PAS;ARTE DELAA XILOGRAFIA, CALCOGRAFIA E LITOGRAFIA;D611-PAS;PS;
PSD612PAS;ARTE DELLA SERIGRAFIA E DELLA FOTOINCISIONE;D612-PAS;PS;
PSD613PAS;ARTE DELLA TIPOGRAFIA E DELLA GRAFICA PUBBLICITARIA;D613-PAS;PS;
PSD614PAS;ARTE DEL TAGLIO E CONFEZIONE;D614-PAS;PS;
PSD615PAS;ARTE DELLA DECORAZIONE PITTORICA E SCENOGRAFICA;D615-PAS;PS;
PSD616PAS;ARTE DELLA MODELLISTICA, DELL'ARREDAMENTO E DELLA SCENOTECNICA;D616-PAS;PS;
PSD618PAS;ARTE DELL'EBANISTERIA, DELL'INTAGLIO E DELL'INTARSIO;D618-PAS;PS;
PSD619PAS;ARTE DELLE LACCHE, DELLA DORATURA E DEL RESTAURO;D619-PAS;PS;
PSD620PAS;ARTE DEL MOSAICO E DEL COMMESSO;D620-PAS;PS;
PSD621PAS;ARTE DELLA LAVORAZIONE DEL MARMO E DELLA PIETRA;D621-PAS;PS;
PSD622PAS;LABORATORIO TECNOLOGICO DELLE ARTI DELLA CERAMICA DEL VETRO E DEL CRISTALLO;D622-PAS;PS;
PSAB77PAS;Chitarra;AB77-PAS;PS;
PSAC77PAS;Clarinetto;AC77-PAS;PS;
PSAD77PAS;Corno;AD77-PAS;PS;
PSAE77PAS;Fagotto;AE77-PAS;PS;
PSAF77PAS;Fisarmonica;AF77-PAS;PS;
PSAG77PAS;Flauto;AG77-PAS;PS;
PSAH77PAS;Oboe;AH77-PAS;PS;
PSAI77PAS;Percussioni;AI77-PAS;PS;
PSAJ77PAS;Pianoforte;AJ77-PAS;PS;
PSAK77PAS;Saxofono;AK77-PAS;PS;
PSAL77PAS;Tromba;AL77-PAS;PS;
PSAM77PAS;Violino;AM77-PAS;PS;
PSAA77PAS;Arpa;AA77-PAS;PS;
PSAN77PAS;Violoncello;AN77-PAS;PS;
PSA845PAS;LINGUA STRANIERA (SLOVENO) ;A845-PAS;PS;
PSAA46PAS;LINGUA E CIVILTA' STRANIERA CINESE;AA46-PAS;PS;
PSAB46PAS;LINGUA E CIVILTA' STRANIERA GIAPPONESE;AB46-PAS;PS;
CTCSS;Classe generica per il conseguimento della specializzazione per le attività di sostegno didattico;CSS;CT;
CLCLIL60;Generica classe per Perfezionamento insegnamento di disciplina non linguistica in lingua (60 CFU);CLIL-60;CL;
CLCLIL20;Generica classe per Perfezionamento insegnamento di disciplina non linguistica in lingua (20 CFU);CLIL-20;CL;
PSAA00PAS;INSEGNAMENTO SCUOLA PRIMARIA;AA00-PAS;PS;
PSEE00PAS;INSEGNAMENTO SCUOLA INFANZIA;EE00-PAS;PS;
